{"$schema":"https://json-schema.org/draft/2020-12/schema","$defs":{"nonnegative_decimal":{"pattern":"^(0|[1-9][0-9]*(\\.[0-9]*[1-9])?)$","type":"string"},"signed_decimal":{"pattern":"^(0|-?[1-9][0-9]*(\\.[0-9]*[1-9])?)$","type":"string"},"date":{"pattern":"^[0-9]{4}-[0-9]{2}-[0-9]{2}$","type":"string"},"safe_value":{"anyOf":[{"type":"null"},{"type":"boolean"},{"type":"number"},{"type":"string"},{"items":{"$ref":"#/$defs/safe_value"},"type":"array"},{"additionalProperties":{"$ref":"#/$defs/safe_value"},"not":{"anyOf":[{"required":["buy"]},{"required":["sell"]},{"required":["trade_instruction"]},{"required":["action_signal"]},{"required":["stop_loss"]},{"required":["take_profit"]},{"required":["auto_execute"]},{"required":["approved"]},{"required":["rejected"]}]},"type":"object"}]},"slot":{"additionalProperties":false,"properties":{"owner":{"const":"Lucien_or_user"},"status":{"const":"unfilled"},"value":{"type":"null"}},"required":["owner","status","value"],"type":"object"}},"additionalProperties":false,"not":{"anyOf":[{"required":["buy"]},{"required":["sell"]},{"required":["trade_instruction"]},{"required":["action_signal"]},{"required":["stop_loss"]},{"required":["take_profit"]},{"required":["auto_execute"]},{"required":["approved"]},{"required":["rejected"]}]},"properties":{"as_of_date":{"$ref":"#/$defs/date"},"candidate_schema_version":{"const":"sunday_weekly_candidate_v0.1"},"human_judgment":{"additionalProperties":false,"properties":{"add_position_discipline":{"$ref":"#/$defs/slot"},"next_week_observation_framework":{"$ref":"#/$defs/slot"},"observation_price_levels":{"$ref":"#/$defs/slot"},"position_and_cost":{"$ref":"#/$defs/slot"},"risk_level":{"$ref":"#/$defs/slot"},"volume_price_structure_description":{"$ref":"#/$defs/slot"}},"required":["risk_level","position_and_cost","add_position_discipline","observation_price_levels","volume_price_structure_description","next_week_observation_framework"],"type":"object"},"input_set_sha256":{"pattern":"^[0-9a-f]{64}$","type":"string"},"metrics":{"additionalProperties":false,"properties":{"average_amount":{"$ref":"#/$defs/nonnegative_decimal"},"average_turnover_rate":{"$ref":"#/$defs/nonnegative_decimal"},"average_volume_ratio":{"$ref":"#/$defs/nonnegative_decimal"},"total_amount":{"$ref":"#/$defs/nonnegative_decimal"},"trading_day_count":{"maximum":5,"minimum":1,"type":"integer"},"week_close":{"$ref":"#/$defs/nonnegative_decimal"},"week_high":{"$ref":"#/$defs/nonnegative_decimal"},"week_low":{"$ref":"#/$defs/nonnegative_decimal"},"week_open":{"$ref":"#/$defs/nonnegative_decimal"},"weekly_change_pct":{"$ref":"#/$defs/signed_decimal"}},"required":["week_open","week_high","week_low","week_close","weekly_change_pct","total_amount","average_amount","average_turnover_rate","average_volume_ratio","trading_day_count"],"type":"object"},"symbol":{"pattern":"^[0-9]{6}$","type":"string"},"trading_dates":{"items":{"$ref":"#/$defs/date"},"minItems":1,"type":"array"},"unresolved_fields":{"items":{"additionalProperties":false,"properties":{"field":{"type":"string"},"source":{"type":"string"},"trade_date":{"$ref":"#/$defs/date"},"value":{"$ref":"#/$defs/safe_value"}},"required":["trade_date","source","field","value"],"type":"object"},"type":"array"},"week_end":{"$ref":"#/$defs/date"},"week_start":{"$ref":"#/$defs/date"}},"required":["candidate_schema_version","symbol","as_of_date","week_start","week_end","trading_dates","input_set_sha256","metrics","unresolved_fields","human_judgment"],"type":"object"}
