{"as_of_date":"2026-07-26","candidate_schema_version":"sunday_weekly_candidate_v0.1","human_judgment":{"add_position_discipline":{"owner":"Lucien_or_user","status":"unfilled","value":null},"next_week_observation_framework":{"owner":"Lucien_or_user","status":"unfilled","value":null},"observation_price_levels":{"owner":"Lucien_or_user","status":"unfilled","value":null},"position_and_cost":{"owner":"Lucien_or_user","status":"unfilled","value":null},"risk_level":{"owner":"Lucien_or_user","status":"unfilled","value":null},"volume_price_structure_description":{"owner":"Lucien_or_user","status":"unfilled","value":null}},"input_set_sha256":"73f08a768f883e54b0d4eaf76c241a0565c469c8c3bfc89d03eef93ed1200a41","metrics":{"average_amount":"80.24225608","average_turnover_rate":"4.608","average_volume_ratio":"1.076","total_amount":"401.2112804","trading_day_count":5,"week_close":"113.42","week_high":"120.45","week_low":"99.77","week_open":"102","weekly_change_pct":"11.6228717645900993996653873"},"symbol":"300274","trading_dates":["2026-07-20","2026-07-21","2026-07-22","2026-07-23","2026-07-24"],"unresolved_fields":[{"field":"disclosure_status","source":"needs_manual_check","trade_date":"2026-07-20","value":true},{"field":"market_indices","source":"needs_manual_check","trade_date":"2026-07-20","value":true},{"field":"news_policy_context","source":"needs_manual_check","trade_date":"2026-07-20","value":true},{"field":"sector_context","source":"needs_manual_check","trade_date":"2026-07-20","value":true},{"field":"disclosure_status","source":"needs_manual_check","trade_date":"2026-07-21","value":true},{"field":"market_indices","source":"needs_manual_check","trade_date":"2026-07-21","value":true},{"field":"news_policy_context","source":"needs_manual_check","trade_date":"2026-07-21","value":true},{"field":"sector_context","source":"needs_manual_check","trade_date":"2026-07-21","value":true},{"field":"disclosure_status","source":"needs_manual_check","trade_date":"2026-07-22","value":true},{"field":"market_indices","source":"needs_manual_check","trade_date":"2026-07-22","value":true},{"field":"news_policy_context","source":"needs_manual_check","trade_date":"2026-07-22","value":true},{"field":"sector_context","source":"needs_manual_check","trade_date":"2026-07-22","value":true},{"field":"disclosure_status","source":"needs_manual_check","trade_date":"2026-07-23","value":true},{"field":"market_indices","source":"needs_manual_check","trade_date":"2026-07-23","value":true},{"field":"news_policy_context","source":"needs_manual_check","trade_date":"2026-07-23","value":true},{"field":"sector_context","source":"needs_manual_check","trade_date":"2026-07-23","value":true},{"field":"disclosure_status","source":"needs_manual_check","trade_date":"2026-07-24","value":true},{"field":"market_indices","source":"needs_manual_check","trade_date":"2026-07-24","value":true},{"field":"news_policy_context","source":"needs_manual_check","trade_date":"2026-07-24","value":true},{"field":"sector_context","source":"needs_manual_check","trade_date":"2026-07-24","value":true}],"week_end":"2026-07-24","week_start":"2026-07-20"}
